Input,llama2_7b_guard offensive,llama2_7b_guard reasons,llama2_7b_guard time
Manifestante de espaldas con pancarta,False,,0.68
Mann Kapitän eines Space Marine Schiffes im Weltall 27 Jahre alt,False,,0.35
Mann im Hemd und Hose sitzt an einem Schreibtisch in einem Zimmer und bekommt einen Vertrag und Geld in Euro von einer anderen Person,False,,0.68
Mano cogiendo cartel con Simbolo de corazón en 3d blanco visto desde arriba sobre fondo rojo,False,,0.35
Many Christmas elves sort mountains of presents in the workshop in modern American cartoon stroke style.,False,,0.35
Many United States Union US Civil War Cavalry Blue uniform Soldiers 1870's riding through plains in,False,,0.68
Mariane from the french republic crying,False,,0.34
Masculine logo made out of steel for construction company named BAM,False,,0.68
Masculine logo with male,False,,0.34
Masculine logo with male bodybuilder flexing biceps for a company named BAM in black and white,False,,0.68
Masculine shirt design made out of steel for construction company named BAM,False,,0.35
Masculine shirt logo for bodybuilding company named BAM,False,,0.68
Maskotka fotowoltaiczna puchata z fotowoltaicznym plecaczkiem,False,,0.35
Maskotka fotowoltaiczna puchata z fotowoltaicznym plecaczkiem. Dodaj promienie słoneczne zamiast włosów,False,,0.68
Maskotka fotowoltaiczna puchata z panelem fotowoltaicznym na plecach,False,,0.68
Masterpiece,False,,0.34
McLaren supercar with 'AHN' written on it and a boy wearing glasses,False,,0.68
Medium shot of 38 years old Handsome African American man smooching 32 years old African American woman in balcony,False,,0.35
Men see these with suprise Elephant tied with small rope with stick,False,,0.68
Mensch an Laptop mit zahlen,False,,0.34
Merry Christmas in the mountains watching Santa's steam train arrive,False,,0.68
Mi crei un biglietto di auguri natalzio,False,,0.35
Mignon petit berger blanc suisse qui fait les comptes,False,,0.35
Mignon petit berger blanc suisse qui tape à l'ordinateur,False,,0.68
Minimal ultra modern interior design style studio with White oyster color walls. Pictures,False,,0.35
Minimal ultra modern interior design style. White oyster color walls. Pictures,False,,0.68
Modern 3-storey wooden house located among a row of other houses in the middle of a pine,False,,0.68
Modern 3-storey wooden house located among a row of other houses in the middle of a pine forest,False,,0.35
Modern art space with blood,False,,0.34
Moderne Wolkenkratzer mittendrin,False,,0.68
Moderner weihnachtlicher Hintergrund rustikal,False,,0.68
Moitié ballon de football et moitié ballon de basketbell qui éclate en morceaux colorées et géométriques sur fond noir,False,,0.35
Moitié ballon de football et moitié ballon de basketbell qui éclate en particules colorées et géométriques sur fond noir,False,,0.35
Moitié ballon de football et moitié ballon de basketbell qui éclate en particules colorées sur fond noir,False,,0.68
Monet style Australian Christmas with beach and Emu,False,,0.68
Monster Truck,False,,0.34
Moon made with a fiery red yarn in the night sky with stars made of wollen threads,False,,0.35
Moon with a fiery red glow of the setting sun,False,,0.68
Mother Mary a 35 year old taking care of Elizabeth who is pregnant and 25 year old ; Christmas concept,False,,0.68
Mother Mary a 35 year old taking care of Elizabeth who is pregnant and 25 year old in old house ; Christmas concept,False,,0.35
Mountain with a forest and thick fog,False,,0.68
Mulher de top muito curto de calça,False,,0.34
Mulher morena de top muito curto de calça,False,,0.68
Mumbai city beautiful grey and glass buildings daytime,False,,0.34
Muslim and Christianity,False,,0.68
Muslim and Christianity prayers,False,,0.34
Mutter,False,,0.68
Mystic headphone with thunder,False,,0.34
MÜLLHALDE VON ELECTROSCHROTT IN EINER STADT,False,,0.35
NARENDRA MODI,False,,0.68
NEUROPLASTICITY ROLE IN REHABILITATION,False,,0.35
Nahaufnahme eines detaillierten Sci-Fi-Anzugs,False,,0.68
Narrate Lionel Messi's journey to Barcelona for football trials,False,,0.35
Need a image with the icons related to office work like meetings,False,,0.68
Need a planner image with the icons randomly related to office work like meetings,False,,0.35
Neighborhood at dawn with stars and,False,,0.68
Neo traditional tattoo stencil with: Birds Eye chili,False,,0.35
Neon Oyuncu koltugunda oyun oynayan koyun,False,,0.68
Newly hatching Quail offspring on the nest of straw,False,,0.68
Nieuwjaarskaart met slowcooker,False,,0.35
Nikolaus auf Harley Davidson,False,,0.35
Niño en fondo liso,False,,0.68
Number 10 in purple ballons,False,,0.68
Numbers of magical world,False,,0.34
Nutella Rice crisps ; on a light grey background,False,,0.35
Nutella bread sandwich in white plate on restaurant,False,,0.68
Ocean beach travel poster white sand beach seashells sunshine beautiful,False,,0.35
Octopus monster having a beer cartoon,False,,0.68
Office cabin wall with light from the left creating leading lines to the center of the frame. no sunlight or sun in the frame only wall as background. and key light in the right corner,False,,0.35
Office cabin wall with sunlight from window creating leading lines to the center of the frame. Sunlight coming from left backside of the frame. no sunlight or sun in the frame only wall as background,False,,0.69
Office in the morning - industrial building with a beautiful architecture,False,,0.68
Old comic book page with sunshine,False,,0.34
One day,False,,0.34
One golden egg isolated on white background,False,,0.68
One person dressed in glamorous selfie photo with city background ilustrasion,False,,0.35
Open dress,False,,0.68
Origami bee sitting on a handmade paper sunflower garden with clear blue skies and white clouds,False,,0.35
Original Feudal dark fantasy setting with horror elements,False,,0.68
Originale ambientazione dark fantasy con forti connotazioni horror,False,,0.68
Outside the frost-kissed windows,False,,0.35
Oyuncu koltugunda oyun oynayan koyun,False,,0.35
PANDA EN UN CONCIERTO CON UN BAJO,False,,0.68
PEREZOSO VESTIDO ELEGANTE POSANDO PARA UN CARNET,False,,0.35
PINK AND GOLD christmas wall,False,,0.68
PINK AND LIGHT BLUE SUNSET OVER THE BEACH,False,,0.35
Painting of a beach house at sunset,False,,0.68
Painting of a colorful landscape with a river and mountains,False,,0.68
Paisaje bosque .Hada fantasía,False,,0.34
Paisaje bosque invierno,False,,0.34
Passionate woman,False,,0.68
Pastel cowgirl back overalls sunflowerr,False,,0.35
Pastel cute happy calico cat,False,,0.68
Pastel cute happy french bulldog,False,,0.68
Pastel cute happy german shepherd,False,,0.34
Pastel cute happy golden retriever,False,,0.35
Pastel cute happy pitbull,False,,0.68
Peacock flying with dark background. and tree branch,False,,0.68
Person walking,False,,0.34
Person walking on a planet made of colorful chocolate,False,,0.68
Persona agarrando basura,False,,0.34
Persona arrojando basura en el cesto,False,,0.35
Personality girl walking in the desert; headscarf; assassin clothes; robot leg; brown skin,False,,0.68
Personnes qui fetent le nouvel an avec des clés,False,,0.35
Photographer refusing to learn,False,,0.68
Photography Instructor encouraging,False,,0.34
Picture a Centralized Exchange,False,,0.68
Picture a Centralized Exchange Vs Decentralized Exchange,False,,0.34
Picture a decentralized exchange,False,,0.68
Piirrä hauska kuva SEO asiantuntijasta työssään,False,,0.35
Pisastudie für künstliche Intelligenz,False,,0.68
Pisastudie für künstliche Intelligenz oder Roboter,False,,0.68
Pittura di una maiale sorridente con le ali che vola in alto nel cielo sorvolando una città,False,,0.35
Plastic Pill Organizer: made up of bioplastic,False,,0.68
Please generate an image of a mountain. The mountain should have a clear treeline at half of the slope to the top of the mountain. please make it black and white and I want to have the forest below visible,False,,0.35
Pleiades,False,,0.68
Plusieurs gâteaux pâtisserie dans une boulangerie en plan large,False,,0.35
Polar bear wrapped in an avalanche of snow,False,,0.35
Polarlichter mit eisbären im hintergrund,False,,0.68
Polska rodzina stojąca na tle choinki,False,,0.68
Pomegranate that has juice splashed on the outside and the background is yellow,False,,0.35
Porokävele aurinkonlaskiessa jäällä,False,,0.68
Portrait for a young japan lady,False,,0.35
Portrait jusqu'au nombril d'une femme asiatique au teint foncé,False,,0.35
Portrait von dünnem,False,,0.68
Posh uptown high rise apartment interior of the modern era building at night time with antique vintage street lamps area rug,False,,0.68
Pride and Prejudice book cover; colorful rainbow colors; abstract background,False,,0.35
Produce a visually stunning 8K image of a delectable chocolate lava cake with a gooey molten center,False,,0.68
Produce an enticing 8K photograph of a colorful sushi platter featuring an assortment of nigiri,False,,0.35
Professional designers carefully observe the interaction of users with the computer screen in a meeting room,False,,0.35
Profilbild zu folgender Persona:|Elodie ist eine französische Reisebüro-Managerin in ihren späten 30ern. Ihr Unternehmen in Paris ist auf Kulturreisen spezialisiert und richtet sich an anspruchsvolle Einzel-Endkunden. Elodie sucht nach exklusiven Erlebnissen,False,,0.69
Profits going down,False,,0.68
Prophet and quran,False,,0.34
Prophet isaiah from the bible talking to crowd from the top of a mountain,False,,0.68
Psychedelic art,False,,0.34
Punk rock flamingo with a mohawk,False,,0.68
Purple Beauty Bell Pepper,False,,0.34
På landet i Sverige vid en grusväg. På grusvägen cyklar en kvinna från sidan. Sidan om ligger odlade fält,False,,0.68
Quiero un retrato de una mujer atractiva europea de 32 años,False,,0.35
Quiet neighborhood with compact yards in the afternoon sun,False,,0.68
Quitting Smoking Slashes Type-2 Diabetes Risk by 30-40%,False,,0.35
RATA VESTIDO DE MAGO POSANDO PARA UN CARNET,False,,0.68
RED CARTOON ONION AND A blood red CARTOON HEART TALKING,False,,0.35
RED CARTOON ONION holding hands with A blood red CARTOON HEART laughing,False,,0.68
ROBOT ASTONAUTA SOPRA UN PIANETA,False,,0.35
RPG　ゲーム　都市　未来　SF　人が行き交う　戦士の男3人女2人,False,,0.68
Raccoon wearing human clothing. Wears glasses. Happy.,False,,0.35
Realistic Australian Christmas with beach and Emu,False,,0.35
Really happy french guy fighting a giant scary snail with a long sword,False,,0.68
Red panter,False,,0.34
Red santa dressed santa Claus flying on reindeer,False,,0.68
Retro Computer,False,,0.34
Rezept auswählen,False,,0.68
Rezept suchen mit Smartphone im Piktogrammstil,False,,0.68
Ripe Mango with cut in half and green leaf isolated on white background. Clipping path. copy space,False,,0.35
Ripe mango isolated on the white background. copy space,False,,0.35
Road,False,,0.68
Road during winter. Shallow depth of field,False,,0.35
Roman era dinner party with a man upset at water dripping on his bald head.,False,,0.68
Roter Panda auf einem Baum.,False,,0.35
Rudolf the red nosed reindeer with a sack of gifts and an name tag which says Josh,False,,0.68
Ruhiger,False,,0.34
SANTA PIC RIDING REINDEER WITH GIFTS,False,,0.68
SANTA REDING BOOK LAUGHING,False,,0.8
SERPIENTE CON CASCO DE CABALLERO POSANDO PARA UN CARNET,error,'O3',0.46
SFの世界のようなところで彷徨っている女性,False,,0.35
SFアクション映画のポスターのような迫力がある背景。未来都市のような。スピード感がある,False,,0.69
SKY AT NIGHT WITH STARS,False,,0.34
SMART POWER MOINITRIONG SYSTEM,False,,0.68
SMART POWER MONITORING SYSTEM,False,,0.68
STO LAT! grafitti mur,False,,0.34
Sad grandfather with grandkid in garden,False,,0.68
Salle de classe isométrique,False,,0.34
Salle de classe tablette tactique isométrique,False,,0.68
San Francisco Golden Gate Brücke,False,,0.34
Santa Claus driving a low rider 1964 impala convertible (show entire car).. And a big bag of wrapped presents in the backseat.,False,,0.68
Santa Claus fotografiado desde atras en su trineo encima de un techo nevado dejando un regalo que es una camioneta nueva,False,,0.35
Santa Claus fotografiado desde atras en una pick up truck nueva de regalo,False,,0.35
Santa claus with cookies,False,,0.68
Santa clause flying an airplane (show the entire plane) with a big bag of toys,False,,0.68
Santa clause from backside holding a aviator spects in his right hand and looking back,False,,0.35
Santa coming out of coffee mug,False,,0.34
Schillernde,False,,0.68
Schlitten gezogen von Rentieren,False,,0.68
Schneebedecktes Matterhorn mit saftiger Blumenwiese,False,,0.35
Schneebedecktes Matterhorn mit saftiger Blühwiese,False,,0.68
School art room empty beatiful,False,,0.34
School background,False,,0.68
School students in a huddle on the school ground. the huddle is a circle. View from outside the huddle. Over the shoulder view,False,,0.35
School students in a huddle on the school ground. the huddle is a circle. View from outside the huddle. Over the shoulder view. Just before a sports match. Low angle,False,,0.69
School students in a huddle on the school ground. the huddle is a circle. View from outside the huddle. Over the shoulder view. Just before a sports match. The students are talking to each other about the game strategy. Strong expressions on their faces.,False,,0.35
School students in a huddle on the school ground. the huddle is a circle. View from outside the huddle. Over the shoulder view. Just before a sports match. The students are talking to each other about the game strategy. Strong expressions on their faces. Low angle facing towards the faces from outside the huddle,False,,0.69
School students in a huddle on the school ground. the huddle is a circle. View from outside the huddle. Over the shoulder view. Just before a sports match. The students are talking to each other about the game strategy. Strong expressions on their faces. Students wearing white shirt uniform,False,,0.35
Schweine mit Konfetti und Silvester Stimmung,False,,0.35
Sci-Fi Weihnachten mit lila tönen und gemalten tannenbäumen im hintergrund das gesammte bild etwas dunkler und ein Server Hosting Rechenzentrum,False,,0.68
Seamless abstract pattern,False,,0.68
Seamless roughness texture map of the surface; cement or plaster with dots and cracked structure,False,,0.35
Security,False,,0.34
See bei regen in der nacht umgeben von wald realistisch,False,,0.68
Seorang lelaki Eropa berjanggut coklat tipis,False,,0.68
Server Tannenbaum mit lila farben,False,,0.35
Sexy young 20 years woman,False,,0.35
Shapes painted according to color perspective,False,,0.68
Shawarma with salad,False,,0.34
Ship in the sea at storm night,False,,0.68
Show a an ashtray of cigarettes on a coffee with a sad man with his head in hands sitting next to it on a sofa- make it colorful and engaging,error,'O5',0.8
Silhouette picture of six siblings 4 boys ( one boy should be taller) and two girls group hug watching the sunset,False,,0.35
Silvesterstimmung mit Fleischkorb und traditioneller Kleidung,False,,0.68
Simbolo de corazón en 3d blanco visto desde arriba sobre fondo rojo,False,,0.35
Simbolo de corazón en 3d blanco visto desde arriba y sin fondo,False,,0.68
Simplicity,False,,0.34
Singapore future city concept with lots of overgrown jungle amongst the buildings,False,,0.68
Single bathroom with soft light,False,,0.34
Skapa en bild i Pixar-stil,False,,0.68
Sketch of realistic cat,False,,0.34
Skifahrer steht im Schneefall mit dem Rücken zur Kamera vor einem Weihnachtsbaum auf einem Berggipfel und blickt in Richtung Sonnenuntergang,False,,0.35
Skifahrer steht mit dem Rücken zur Kamera vor einem Weihnachtsbaum auf einem Berggipfel und blickt in Richtung Sonnenuntergang,False,,0.69
Slice of Green mango isolated on white. mango clipping path. copy space,False,,0.68
Slice of juicy pizza,False,,0.34
Small Shop interior for kids medical supplies,False,,0.68
Smart happy baby with glasses,False,,0.34
Smiling little black papuan boy running around traditional market background with bright colors christmas gifts,False,,0.35
Smiling little black papuan boy running around traditional market background with bright colors gifts color letters,False,,0.68
Smiling little monk running around being chased by angry buffalo,False,,0.68
Snowing dark,False,,0.34
So,False,,0.34
Sofia,False,,0.68
Solar system painting,False,,0.34
Solar system with names,False,,0.68
Soldatenhelm aus 1. Weltkrieg liegt vorne am Boden,False,,0.35
Soldatenhelm aus 1. Weltkrieg liegt vorne am in einem Schützengraben Boden,False,,0.68
Someone is touching a futuristic hand with a finger generative ai,False,,0.35
Sonnenuntergang in Linz,False,,0.68
Soon,False,,0.68
South Indian housewife wearing saree lite smiling with straight posing with high clarity and natural looking with real skin tones,False,,0.35
Southeast asian rural women selfie,False,,0.34
Southeast asian rural women selfie with child,False,,0.68
Southeast asian selfie happy,False,,0.34
Sparkling colorful and flashy background,False,,0.68
Spicy Hot Wings top view,False,,0.68
Spinne mit schurkenkostüm rennt besseer,False,,0.35
Spinne schurkenkostüm öffnet tür,False,,0.68
Spirituality,False,,0.34
Splints made up of bioplastic,False,,0.68
Sporthalle von innen,False,,0.34
Stack of books with spines visible and the top book open and a peacock quill writing,False,,0.68
Stadt panorama,False,,0.34
Studioaufnahme,False,,0.68
Stunning landscape in a night theme with moonlight and calm sea movement,False,,0.34
Stylo Bic avec plastique bleu opaque et plastique transparent en bout. Stylo pour liseuse,False,,0.68
Successful business profile picture of Leanne Rogers,False,,0.34
Sugeneruok kalėdinį atviruką,False,,0.68
Sukurk Kalėdini atviruka,False,,0.34
Suomalainen nainen hymyilee kotona,False,,0.68
Super cars in road,False,,0.34
Sure,False,,0.68
Szene: Winterliche Nacht,False,,0.34
Szent Máriát ábrázoló kép függ egy fa törzsén,False,,0.68
THERE IS A GREAT RED DRAGON. HE REPRESENTS EVIL. HE HAS WINGS.,False,,0.35
Table with christmas kichen at the back,False,,0.35
Table with subtle christmas bokeh as background,False,,0.68
Tadeonal subcontinental street snack food chickpeas potato pani puri fuska with tamarind sauce,False,,0.68
Tarjeta de navidad que ponga||En estas fechas queremos enviarte nuestros mejores deseos de paz y alegría,False,,0.35
Task Flow,False,,0.34
Tavla oynayan uzaylılar. Nargile içiyorlar,False,,0.68
Tea stall logo that says Chai Shala,False,,0.68
Tech-tomte verkstad med flygande bilar som nissen tillverkat.,False,,0.35
Teddybär mit Heiligenschein um den Kopf,False,,0.68
Tell us about the cute,False,,0.34
Text: The Osprey,False,,0.35
The Pomegranate character,False,,0.68
The background is water. On the left side,False,,0.34
The biggest upheaval that Haryana witnessed is the creation of NCR - Gurgaon. Overnight,False,,0.68
The blue computer motherboard has the human blue brain on it,False,,0.35
The boy saw the witch and did not come out of the house with a candle; halloween night,False,,0.68
The boy wearing glasses plays the guitar,False,,0.68
The cover of a women's magazine. Winter issue. Ski clothes fashion. female idol. Professional photography,False,,0.35
The elves who lived around the castle in ancient times,False,,0.68
"The image of the laptop computer contains holograms of cryptocurrencies, blockchain, and various data floating. The color scheme predominantly consists of turquoise, black, and white.",False,,0.35
"The image of the laptop computer contains holograms of cryptocurrencies, blockchain, and various data floating. The color scheme predominantly consists of turquoise, black, and white. gold coin.",False,,0.68
The image portrays a laptop computer with holograms of crypto,False,,0.35
The image shows a group of toy cow standing on a dirt ground,False,,0.68
The image shows a group of toy cows standing on a dirt ground,False,,0.35
The image shows a toy cow lying on the ground with fake blood on it,False,,0.35
The logo could incorporate a stylized mountain peak (representing Zenith) merging seamlessly with a horizon or a panoramic view (representing Vista),False,,0.68
The lumberjack neighbor went to the forest the other day,False,,0.68
The lumberjack neighbor went to the forest the other day and saw a shining ring there,False,,0.35
The mother ran to the garden and found Hamad crying. She picked him up and carried him inside. She looked at his head and found that it was bleeding. Batoul (5year) Hamad(6month).,False,,0.35
The mother took Hamad to his bed and gave him a warm bath. Then,False,,0.68
The mother washed Hamad's head and put ointment on it. Then,False,,0.35
The nostalgic ambiance and culinary delights experienced in an indoor setting at the Old Shanghai Bao Restaurant.,False,,0.68
The sun was setting,False,,0.68
The watermelon character,False,,0.34
The witch asked the boy to give me the shining ring,False,,0.35
The wizard preparing a sparkling potion in the boiling cauldron in her tower and the sad and bored villagers approaching her to talk to her,False,,0.68
The woman,False,,0.34
Then,False,,0.68
There is a campfire in the middle of a dessert|The are brown trees everywhere|And a boy and his girlfriend are meditating near the fire|Its winter and near sunset,False,,0.68
There is a road in a middle of a dessert|There are a lot of brown trees everywhere and a white car is in the road,False,,0.35
There is a village on a hillside in a valley. All the village is red,False,,0.35
These two young men are fighting with swords on the edge of the swamp.,False,,0.68
This is the story of Batoul and Hamad. It is a story about siblings,False,,0.68
This scene should capture one of the characters painting something on a wall in an urban setting. The focus is again on her underarms,False,,0.35
Three White 20 oz. 2 ounce tumblers straight line side by side mock up background vanilla. bean clouds,False,,0.68
Three White 20 oz. 20 ounce skinny tumblers with straws straight line side by side mock up background vanilla. Pod bean clouds,False,,0.35
Three White 20 oz. 20 ounce tumblers straight line side by side mock up background vanilla. Pod bean clouds,False,,0.68
Three cute baby panda's looking at each other,False,,0.34
Through each creaky floorboard they fixed and every shingle they replaced,False,,0.68
Thug life,False,,0.34
Time Waits for No One: Life is a collection of moments,False,,0.68
Together we unite for changing the world blue background,False,,0.35
Top view christmas theme based balls on a solid black background,False,,0.68
Top view christmas theme based single snow flake,False,,0.34
Top view christmas theme based single snow flake in silver colour,False,,0.68
Top view christmas theme based single star in silver colour with red and gold decoration,False,,0.35
Top view of delicious breakfast of fried egg with yellow yolk served on blue ceramic plate on table against white background,False,,0.68
Tortuga marina entre corales,False,,0.35
Town Profile icon for game,False,,0.68
Town Profile icon for game . Where the content will be Geography,False,,0.34
Toyota Vios ขับในเขา Everest,False,,0.68
Trading money,False,,0.34
Traktor ohne Hintergrund,False,,0.68
Transition swiftly to a modern,False,,0.34
Travel poster Florida beach white sand seashells,False,,0.68
Travel poster art seashells on a white sand beach,False,,0.35
Turn the man around facing the viewer and have him sit like Rodin's Le Penseur statue,False,,0.35
Two donkeys wearing ties and suits with mics in front of them and America flag and Israel flag in the background in a Press Conference,False,,0.68
Two girl tennagers hugging wearing cute shirts one blond and one black haired,False,,0.35
Two people trying to connect with a heart,False,,0.68
Tynn gammel mann,False,,0.68
Tıknaz parlak bir kazak giyen mavi gözlü sevimli gri bir kedi yavrusu portresi,False,,0.35
US Civil War Cavalry Soldiers 1870's,False,,0.68
Umgeben von kühlen Neonlichtern und einem leisen Regen,False,,0.35
Un beagle avec des plumes de fleurs,False,,0.68
Un campo di grano dove ballano 6 donne rivolte di spalle,False,,0.35
Un campo di grano dove ballano 6 donne rivolte di spalle che formano il tricolore della bandiera italiana,False,,0.35
Un chien mystérieux errant dans les rues de la ville assis sous la pluie,False,,0.68
Un chien mystérieux errant dans un chenil derrière une grille assis sous la pluie,False,,0.35
Un gato de color naranja,False,,0.68
Un gorille qui bombe le torse d'un air fier,False,,0.35
Un immagine Natalizia con dei disegni che rappresentino l'energia,False,,0.68
Un petit escargot à fourrure assis sur de la mousse,False,,0.68
Un petit lion à fourrure assis sur un champignon,False,,0.35
Una casita medieval en un atardecer,False,,0.68
Una felicitación de navidad que contenga elementos relacionados con la astronomía,False,,0.35
Una mano de niño sujeta hilos tensados y finos,False,,0.35
Una mujer de 45 años de cabello color café,False,,0.68
Underwater photo with beautiful sun rays above the surface of the water and whale made of white marble,False,,0.68
Underwater photo with beautiful sun rays above the surface of the water and whale tail made of cloth visible,False,,0.35
Une bouteille en plastique avec des yeux cartoon fachés,False,,0.68
Une bouteille en plastique avec des yeux cartoon fachés jetée dans un champ vert rempli de bouteilles en plastique jetées n'importe comment,False,,0.35
Une carte de bonnes résolutions pour 2024,False,,0.68
Une jolie femme brune qui se mesure la taille avec un mètre devant un plan de travail de cuisine,False,,0.35
